{
  "id": "weapon:sword",
  "display_name": "Sword",
  "weapon_type": "sword",
  "character_ids": [
    "character:cao-cao",
    "character:liu-bei"
  ],
  "appearances": [
    {
      "game_id": "game:dynasty-warriors-3",
      "role": "playable"
    },
    {
      "game_id": "game:dynasty-warriors-8",
      "role": "playable"
    },
    {
      "game_id": "game:dynasty-warriors-9",
      "role": "playable"
    }
  ],
  "playstyle_tags": [
    "balanced",
    "beginner-friendly"
  ],
  "acquisition": [
    {
      "game_id": "game:dynasty-warriors-3",
      "method": "default",
      "provenance": {
        "category": "community_observation",
        "contributor": "musoudb_seed",
        "contributed_at": "2026-08-03T00:00:00Z",
        "sources": [
          {
            "kind": "in_game_observation",
            "citation": "Verified by a contributor during play; see revision history."
          }
        ]
      }
    },
    {
      "game_id": "game:dynasty-warriors-8",
      "method": "default",
      "provenance": {
        "category": "community_observation",
        "contributor": "musoudb_seed",
        "contributed_at": "2026-08-03T00:00:00Z",
        "sources": [
          {
            "kind": "in_game_observation",
            "citation": "Verified by a contributor during play; see revision history."
          }
        ]
      }
    }
  ],
  "summary": {
    "blocks": [
      {
        "spoiler_level": "none",
        "text": "The series' baseline one-handed moveset: short reach, fast recovery, and the usual starting point for new players.",
        "language": "en"
      }
    ]
  },
  "tags": [
    "starter-weapon"
  ],
  "provenance": {
    "category": "community_observation",
    "contributor": "musoudb_seed",
    "contributed_at": "2026-08-03T00:00:00Z",
    "sources": [
      {
        "kind": "in_game_observation",
        "citation": "Verified by a contributor during play; see revision history."
      }
    ]
  },
  "meta": {
    "schema_version": "0",
    "revision": 1,
    "created_at": "2026-08-03T00:00:00Z",
    "updated_at": "2026-08-03T00:00:00Z",
    "status": "accepted"
  }
}
